13550 packets captured
13678 packets received by filter
128 packets dropped by kernel
root@lamp-s-1vcpu-1gb-tor1-01:~# ^C
root@lamp-s-1vcpu-1gb-tor1-01:~# tcpdump -c 5 -i eth0
tcpdump: verbose output suppressed, use -v or -vv for full protocol decode
listening on eth0, link-type EN10MB (Ethernet), capture size 262144 bytes
19:19:49.918108 IP lamp-s-1vcpu-1gb-tor1-01.ssh > 198.96.85.21.51655: Flags [P.], seq 3154548406:3154548514, ack 2968911300, win 1349, length 108
19:19:49.918201 IP lamp-s-1vcpu-1gb-tor1-01.ssh > 198.96.85.21.51655: Flags [P.], seq 108:144, ack 1, win 1349, length 36
19:19:49.918287 IP lamp-s-1vcpu-1gb-tor1-01.ssh > 198.96.85.21.51655: Flags [P.], seq 144:252, ack 1, win 1349, length 108
19:19:49.918356 IP lamp-s-1vcpu-1gb-tor1-01.ssh > 198.96.85.21.51655: Flags [P.], seq 252:288, ack 1, win 1349, length 36
19:19:49.919923 IP lamp-s-1vcpu-1gb-tor1-01.ssh > 198.96.85.21.51655: Flags [P.], seq 288:468, ack 1, win 1349, length 180
5 packets captured
9 packets received by filter
0 packets dropped by kernel
root@lamp-s-1vcpu-1gb-tor1-01:~#
