root@lamp-s-1vcpu-1gb-tor1-01:~# tcpdump -r 0001.pcap
reading from file 0001.pcap, link-type EN10MB (Ethernet)
19:25:16.056753 IP lamp-s-1vcpu-1gb-tor1-01.ssh > 198.96.85.21.51655: Flags [P.], seq 3164890438:3164890482, ack 2968917572, win 1349, length 44
19:25:16.057368 IP lamp-s-1vcpu-1gb-tor1-01.ssh > 198.96.85.21.51655: Flags [P.], seq 44:152, ack 1, win 1349, length 108
19:25:16.057439 IP lamp-s-1vcpu-1gb-tor1-01.ssh > 198.96.85.21.51655: Flags [P.], seq 152:188, ack 1, win 1349, length 36
19:25:16.059279 IP 198.96.85.21.51655 > lamp-s-1vcpu-1gb-tor1-01.ssh: Flags [.], ack 44, win 4112, length 0
19:25:16.059309 IP 198.96.85.21.51655 > lamp-s-1vcpu-1gb-tor1-01.ssh: Flags [.], ack 188, win 4111, length 0
19:25:18.031319 IP 78.109.69.138.50321 > lamp-s-1vcpu-1gb-tor1-01.microsoft-ds: Flags [S], seq 4212405663, win 8192, options [mss 1420,nop,wscale 2,nop,nop,sackOK], length 0
root@lamp-s-1vcpu-1gb-tor1-01:~#
